[
  {
    "capability": "news.ticker_digest",
    "model": "openai/gpt-6-luna",
    "datasetVersion": "1",
    "scores": {
      "schema_valid": 1.0,
      "numbers_in_sources": 1.0,
      "source_ids_exist": 1.0,
      "judge_faithful": 0.93,
      "judge_specific": 0.84
    },
    "passed": true,
    "at": "2026-09-26T19:06:12Z",
    "costUsd": 0.0412,
    "durationMs": 186400
  },
  {
    "capability": "news.us_rank",
    "model": "openai/gpt-6-luna",
    "datasetVersion": "1",
    "scores": {
      "schema_valid": 1.0,
      "source_ids_exist": 1.0,
      "numbers_in_sources": 1.0,
      "must_include": 0.75,
      "judge_specific": 0.82
    },
    "passed": false,
    "at": "2026-09-26T19:10:31Z",
    "costUsd": 0.0587,
    "durationMs": 241900
  },
  {
    "capability": "papers.qa",
    "model": "openai/gpt-6-luna",
    "datasetVersion": "1",
    "scores": {
      "schema_valid": 1.0,
      "pages_in_range": 1.0,
      "must_include": 0.85,
      "judge_faithful": 0.92
    },
    "passed": true,
    "at": "2026-09-26T19:17:48Z",
    "costUsd": 0.1938,
    "durationMs": 412700
  }
]
